Region,CNTRY_NAME,Tier,Primary Data Type,Primary Year,Primary Source,Secondary Data Type,Secondary Year,Secondary Source,NotesAfrica,Angola,1,report,2000,"FAO, 2001. Evaluation des resources forestieres mondiales 2000. Rapport Principal. Etude FAO Forets 140.",report,1975,Horsten F. 1983. Madeira - Une analise de situacao actual. ,America,Anguilla,1,report,1982,Caribbean Development Bank 1984. Regional Forestry Section Study: Final Report,n/a,n/a,n/a,America,Antigua and Barbuda,1,report,1980,"Atkins Land and Water Management. 1983. Soil and water conservation, Windward and Leeward Islands, Phase 1: Reconnaissance Study.",report,1991,"Bacon, PR. 1991. The Status of Mangrove Conservation in the Caricom Islands of the Eastern Caribbean.",America,Aruba,1,atlas,1986,Atlas published by Eastern Caribbean Natural Area Management Program,n/a,n/a,n/a,America,Bahamas,1,report,2000,FAO 2001. Validation Sheet Bahamas. FAO Rome,paper,1991,"Bacon, PR. 1993. Mangroves in the Lesser Antilles, Jamaica and Trinidad and Tobago. In: Lacerda L.D. 1993",Asia,Bangladesh,3,report,2005-2007,National Forest and Tree Resources Assessment,imagery,2011-2012,forest land cover map,America,Barbados,2,imagery,2001,"Helmer, E. et al. 2007: Distribution of land cover and forest formations for St. Kitts, Nevis, St Eustatius, Frenada, and Barbados for satellite imagery",n/a,n/a,n/a,America,Belize,1,report,2004,"Meerman, J. and W. Sabido 2001. Central American Ecosystems: Belize. Programme for Belize, Belize City (update in 2004, but without citation).",imagery,2012,"Cherrington et al. 2012. Forest Cover and Deforestation in Belize, 2010-2012",Africa,Benin,1,report,2007,"PBR2-2007. Inventaire forestier national ProCGRN, 2008 (PGDRN)",report,1996,"Akpado, L. 2000. Etude sur les formation forestieres naturelles et sur les plantations forestieres au Benin CE-FAO-Programme Partenariat (1998-2000)",Asia,Bhutan,2,report,1995,"RGOB, 1995. Land Cover Figures of Bhutan, Ministry of Agriculture, Royal Government of Bhutan",report,2010,MoAF. 2010. Technical report Bhutan Land Cover Assessment 2010 (LCMP 2010),America,Bolivia,1,imagery,2010,"Mapa de Cobertura y Uso Actual de la Tierra 2010-Viceministerio de Tierras-MDRyTMapa de Cobertura y Uso Actual de la Tierra, 2001-Superintendencia Agraria",imagery,2011,Avance de la deforestacion en Bolivia Autoridad de Bosque y Tierra,Africa,Botswana,1,report,1990,"Land Utilization Division, Ministry of Agriculture, Republic of Botswana. 1990. Land Systems Map of the Republic of Botswana.",report,2005,FRA 2000. Botswana country report.,America,Brazil,1,imagery,2002,"Ministry of Environment (MMA)/Project for Conservation and Sustainable Use of Brazilian Biological Diversity (PROBIO), 2007. Laventamento e mapeamento dos remanescentes de cobertura vegetal dos biomas em 2002. ",report,2002-2008,"Ministry of Environment (MMA)/ Brazilian Environmental and Renewable Natural Resources Institute (IBAMA) - Center of Remote Sensing, 2009.",America,British Virgin Islands,1,report,1980,"Caribbean Conservation Association 1980. Preliminary Data areas - British Virgin Islands: Toortula, Virgin Gorda & Anegada. Caribbean Conservation Association. University of Michigan, USA.",report,2001,British Virgin Islands Government. 2001 Use of the coastal zones and seabeds (provided Mangrove forest numbers).,Asia,Brunei,1,report,1996,"DOF, 1996. An Introduction to Forestry in Brunei Darussalam. Department of Forestry, Ministry of Industry and Primary Resources, Brunei Darussalam.",report,1979,"Anderson & Marsden, 1984. Forest Resources & Strategic Planning Study",Africa,Burkina Faso,2,report,2002,"MAHRH, 2006: Base de Donnees d'Occupation des Terres (BDOT) du Burkina Faso (1992 et 2002)/ Ministere de l'Agriculture, de l'Hydraulique et des Ressources Halieutiques",report,2012,"MEDD, 2013 a: Bilan annuel de la campagne nationale de reforestation 2012.",Africa,Burundi,1,report,2005,Min Env: Analyse d'attenuation des emissions de gaz a effet de serre.,report,2001,MINATET. Prospective d secteur forestier en Afrique a l'horizon 2020 (FOSA),Asia,Cambodia,3,imagery,2005,"""original remote sensing data with adequate ground truthing""",imagery,2002,"""original remote sensing data with adequate ground truthing""",Africa,Cameroon,1,report,2004,National Forest Assessment,report,2000,Rapport principal. Evaluation des ressources forestieres mondailes 2000. Forestry Paper 140 FAO. 2001,America,Cayman Islands,3,report,2009,Cayman Islands National Biodiversity Action Plan 2009 (habitat mapping data source),book,2008,"Burton, FJ (2008b). Vegetation Classification for the Cayman Islands. In: Threatened Plants of the Cayman Islands: The Red List. Pub. Royal Botanic Gardens Kew: Richmond Surrey UK.",Africa,Central African Republic,1,report,1999,"Mangala P.M., Zanga A. 1999. Republique Centrafricaine. Evaluation des ressouces forestieres ligneuses. Etude realisee dans le cadre de FRA 2000. FAO",report,2010,Les Forets du bassin du Congo: Etat des Forets 2010,Most numbers are from 1999 or older. 2010 provided suplimental information.Africa,Chad,1,report,2013,Programme systeme d'Information pour le Developpement Rural et L'Amenagement du Terriotire,report,1999,"Rapport de consultation (FAO) sur les ressouces forestieres et les plantations: Bardoum Djekourbain, 1999.",America,Colombia,2,imagery,2012,"IDEAM, 2013. Memoria Tecnica de la Cuantification de la deforestacion historica nacional escalas fina, (en proceso de publication). IDEAM, 2013. Concentracion de alertas tempranas de deforestacion para el primer semestre de 2013.",report,2010,"Cabrera, et. al, IDEAM, 2011. Memoria Tecnica de la Cuantificaion de la deforestacion historica nacional escalas gruesa y fina. Instituto de Hidrologia, Meteorologia y Estudios Ambientales - IDEAM - Bogota, D.C. Colombia 106p",America,Costa Rica,3,imagery,2013,Sistema Nacional de Areas de Conservacion (SINAC/MINAE). Unidad de Monitoreo Forestal. 2013.,imagery,2005,"Fondo Nacional de Financiamiento Forestal. 2007. Estudio de Monitoreo de Cobertura Forestal de Costa Rica 2005. San Jose, Costa Rica. 2007.",Africa,Cote d'Ivoire,1,imagery,1993,"Ministere de l'Agriculture et des Ressources Animales. Developpement rural et preservation de l'environnement forestier. Ejeux et prespectives en zone de foret dense DCGTx, Dec. 1993.",report,2004,"Minist. D'Etat, Minist. De l'Agriculture (Dir des cultures. Perennes)",America,Cuba,1,report,2011,"Documento de la Dinamica Forestal, Direccion Forestal, Ministerio de la Agricultura. Emision anual",report,2011,Servicio Estatal Forestal,Africa,Democratic Republic of the Congo,1,report,2005,Rapport FRA 2005,n/a,n/a,n/a,Africa,Djibouti,1,report,1985,Cirad - IEMVT. 1987. Carte de la vegetation et des ressources pastorales. 1/250 000. dans: Institute de la carte internationale de la vegetation (1991),n/a,n/a,n/a,America,Dominica,1,imagery,2000,"Wood, E. 2000. Land cover map for Dominica. Carbbean Vegetation and Landcover Mapping Initiative. The Nature Conservancy, International Institute of Tropical Forestry, US Forest Service, EROS Data Center, and US Geological Service.",aerial photography,1984,Meteorolog�a y Estudios,America,Dominican Republic,3,imagery,2012,DR. Ministerio de Medio Ambiente y Recursos Naturales 2013. Mapa de uso de la tierra y cobertura forestal,n/a,n/a,n/a,America,Ecuador,3,imagery,2008,"Ministerio del Ambiente del Ecuador, Proyecto Mapa Historico de Deforestacion del Ecuador Continental (MDH). Mapas de uso y coberrtura de la tierra de lo anos 1990, 2000, 2008.",report,2003,"Puyravaud, J. 2003. Standarizing the calculation of the annual rate of deforestation. Forest Ecology and Management.",America,El Salvador,1,imagery,2002,"Instituto Geografico Nacional de El Salvador, 2003. Mapa de Ocupacion del Suelo.",n/a,n/a,n/a,"There are other sources used for definitions and context, but only the 2002 source was used for reported numbers."Africa,Equatorial Guinea,1,report,1990,FAO. 1992. Guinea Ecuatorial. Inventario Forestal Explotario. Isla de Bioko,report,1991,FAO. 1991. Guinea Ecuatorial. Informe sobre la consultoria en fotointerpretacion.,Africa,Eritrea,1,report,1997,FAO. 1997. Support to Forestry and Wildlife subsector. Pre-investment study tcp/eri/6721,report,2000,FRA 2000.,Africa,Ethiopia,2,report,1995,"Woody Biomass Inventory and Strategic Planning Project, Ministry of Agriculture and Rural Development, May 2004 (used imagery from 1995, and 1986-1989)",report,2000s,"""several local level scholarly studies, MSc and PhD studies based on satellite imageries and GIS analyses""",2008 data source that only covered planted forestsAmerica,French Guiana,2,report,2012,PAG 2012 - Occupation du sol sur le territoire du Parc Amazonien de Guyane. ,report,2006,IFN 2008 - Suivi de l'occupation du sol et des changements d'occupation de sol en Guyane par teledetection satellitaire.,Africa,Gabon,2,report,2013,PDSIRFN (project development of an inventory system),report,2013,"Rapport de pre stratification forestiere, 2013, PDSIRFN; Plan national climat, 2013",Africa,Ghana,2,report,1990-2010,"Report on mapping of forest cover and carbon stock in Ghana. Mapping Consultants Services, The Forest Preservation Program, Under a Japanese Grant Aid to the Republic of Ghana, 2013.",report,1996,"Kotey NA et al. (1998) Falling into Place, Ghana, Policy that Works for Forest and People. IIAD. United Kington. IIAD 1996.",America,Grenada,1,imagery,2000,"Helmer et al 2008. Land Cover and Forest Formation Distributions for St. Kitts, Nevis, St. Eustatius, Grenada and Barbados from Decision Tree Classification of Cloud Cleared Satellite Imagery",report,1991,"Paterson, G. 2000. Grenada Country Report: Forestry outlook study for the Caribbean. In: Proceedings of Sub-regional Workshop on Data Collection and Outlook Effort for Forestry in the Caribbean, Port-of-Spain, Trinidad and Tobago, 21-25 Feb 2000. FAO, Rome.",America,Guadeloupe,2,report,2012,"Thomas Gilardoni, Utilisation des outils de teledetection pour cartographier les espaces bioses de la Guadeloupe et proposition de seuils des massifs pour les demandes de defrichement",report,2011,"DEAL Guadeloupe, Profil environnemental regional de la Guadeloupe 2011",America,Guatemala,2,report,2010,Mapa de Cobertura Forestal de Guatemala 2010 y Dinamica de la Cobertura Forestal 2006-2010,report,2003,Mapa de uso del suelo 2003,Africa,Guinea,1,report,2005,FRA 2005 rapport principal,report,1988,"Republique de Guinee, 1988. Politique et plan d'action. Annexe 1. Vegetation et forets. Plan d'action forestier tropical.",Africa,Guinea-Bissau,1,imagery,1990,CIRAD foret. 1992. Evaluation des surfaces forestieres en Guinee-Bissau: Programme d'Action Forestier Tropical (PAFT),report,1976,"SCET International. 1978 Potentialites agricoles, forestieres et pastorales - 3 volumes.",America,Guyana,2,report,2009,Guyana REDD+ Monitoring Reporting and Verification System Interim Measures Report (1 Oct 2010-31 Dec 2011),report,2013,Guyana National Land Use Plan (used for land use classes),America,Haiti,1,report,1988,"Universite Catholique de Louvain, 1998. Etude de la deforestation et la degradation de l'environment a Haiti. In FAO, 1998. Forestry policies in the Caribbean.",report,1956,"FAO, 1978. Reboisement et lutte contre l'ecrosion Haiti. Etude qualitative et quantitative de l'evolution du couvert forestier entre 1956-1958.",A 1990 source was used for planted areasAmerica,Honduras,1,report,2005,"Evaluacion Nacional Forestal. Resultados del inventario de bosques y arboles 2005-2006, FAO, AFE-COHDEFOR",report,2000,"AFE-COHDEFOR, Anuario Estadistico Forestal",Asia,India,3,imagery,2008,"India State of Forest Report, 2011. Forest Survey of India, MOEF, GOI, India.",imagery,2000,"State of Forest Report, 2001. Forest Survey of India, MOEF, GOI, India.",Asia,Indonesia,3,imagery,2006,"Indonesia Land Cover Recalculation 2008. (In Indonesia) Forestry Planning Agency, MoF Indonesia.",imagery,2003,"Indonesia Land Cover Recalculation 2003. (In Indonesia) Forestry Planning Agency, MoF","Report states that ""2003 and 2006 data"" were used to extrapolate forest area. There is no obvious 2006 data, so the primary source is assumed. There is also a ""Deforestation Account of Indonesia, 2006-2009 listed in the data sources."America,Jamaica,2,imagery,1998,"Evelyn OB and Camirand R. 2003 Forestry cover and deforestation in Jamaica: an analysis of forest cover and estimates over time. Jamaica. International Forestry Review, 5(4) 2003, pp. 354-363 (table6)",n/a,n/a,n/a,Africa,Kenya,2,imagery,2010,Report on National Forest Resource Mapping and Capacity Development for the Republic of Kenya: Vol 2.,report,1994,Kenya Forestry Master Plan 1994,Also includes 2008 plantation data sourceAsia,Laos,2,imagery,2010,"Remote Sensing, FIPD, FIM (JICA) Alos, Spot5, Rapideye",imagery,2002,"Remote Sensing, FIPD, SIDA (Sweden), SPOT 4 and 5 (visually)",Africa,Liberia,1,imagery,2006,CI_SDSU Christie et al (2007) (data from 2000-2006),imagery,2003,"Nocholas Bayol et Jean-Franquis Chevelier, 2004. Current State of the Forest Cover in Liberia; Forest information Critical to Decision Making Study Report. World Bank. Washington USA",Africa,Madagascar,1,imagery,2010,"ONE, FTM, MNP",report,1996,"Direction Generale des Forests, Resultats de I'Inventoaire Ecologieque Forestier National (IEFN)",Africa,Malawi,2,report,1990,"Department of Forest, Ministry of Forestry and Natural Resources. 1993. Forest Resources Mapping and Biomass Assessment for Malawi. Implementing agency: Satellitbild",report,2012,"Department of Forestry, Ministry of Environment and climate Change Management 2012, Forest Resource Mapping Project under the Japanese Grant for Forest Preservation Programme.","Report states that 1990 is the most up to date source used for numbers, but a 2012 source is also listed in the source table."Asia,Malaysia,3,report,2012,Forestry Department of Peninsular Malaysia. Annual Report and Statistics Report,report,2012,Sarawak and Sabah Forestry Department,Report cites many province level forestry annual and statistical reports from 1988-2012Africa,Mali,1,imagery,2013,imagery interpretation using CollectEarth,report,2006,PELACD. Etude d'inventaire forestier en 5eme 6eme et 7eme Regions du Mali. Tome 1 methodologie - aspects technique et organisationnels.,America,Martinique,1,report,2008,"Durrieu de Madron, 2008, Expertise sur les references dendrometriques necessaries au renseignement de l'inventaire national de gaz a effet de serre pour les forets de la Gaudeloupe, Martinieuq et Reunion.",report,2004,"IFN, 2008, Cartographie des grands espaces forestiers et naturels de la Martinque",Africa,Mauritania,1,report,2010,FRA 2010 Mauritanie,report,2004,Inventaire de l'occurpation de sol de la rive droite de fleuve Senegal,These are partial inventories. Data is also taken from 1999 and 1981 dated sources.America,Mexico,2,imagery,2011,"Conjunto de datos Vectoriales de la Carta de Uso del Suelo y Vegetacion. Escala 1:250,000 Serie V Continuo Nacional. INEGI",imagery,2007,"Conjunto de datos Vectoriales de la Carta de Uso del Suelo y Vegetacion. Escala 1:250,000 Serie IV Continuo Nacional. INEGI",America,Montserrat,1,report,1982,"Caribbean Development Bank 1983. Regional Country Sector Study, Country Report, Monserrat",report,1985,"CARICOM Tropical Forestry Action Plan Montserrat 1991 (used for ""other wooded land"")",Africa,Mozambique,2,imagery,2005,"Jansen Jansen, L et al. 2006. Satellite image interpretation of landcover types in Manica and Maputo Provinces at nominal scale of 1:250 000 and at National level scale of 1: 1000000. DNTF_AIFM, Maputo",report,2012,"DNTF, 2010. Relatorio Annual 2009, 2010, 2011, 2012 Mapto (used for Afforestation Areas)",Asia,Myanmar,2,imagery,2010,remote sensing interpretation,imagery,2006,remote sensing interpretation,Africa,Namibia,1,report,2000,Forest Policy in Namibia,report,1992,"Holm, D.  and Graz, P. 1992. Forest Cover Mapping Northern Namibia Phase I II, Vol I II",Asia,Nepal,1,report,1998,"DFRS, 1999. Forest Resources of Nepal (1987-1998). Department of Forest Research and Survey, Ministry of Forest and Soil Conservation, Kathmandu, Nepal",,1979,"HMGN/ADB/FINNIDA, 1998. Master Plan for the Forestry Sector in Nepal. (Based on Land Resources Mapping Data from 1978/79",America,Netherlands Antilles,2,report,1991,"International Institute of Tropical Forestry, USDA Forest Service. 2000. The 2000 FAO Forest Resource Assessment for the Caribbean",n/a,n/a,n/a,America,Nicaragua,3,report,2008,Inventorio Nacional Forestal,report,2000,"Instituto Nacional Forestal, Ministerio Agropecuario y Forestal (INAFORMAGFOR)",Africa,Niger,2,report,2005,FRA 2005 report,report,1977,Fontes J. 1985. Evaluation des ressources forestieres au Niger. Situation 1980-1985.,Africa,Nigeria,1,report,1994,"Olufemi A. Olaleye and Ameh, CE 1999. Forest Resource Situation Assessment of Nigeria EC-FAO Partnership program.",n/a,n/a,n/a,Asia,Palau,3,imagery,2002,"Preliminary land cover assessment for the Republic of Palau, USDA Forest Service, Pacific Northwest Forest Inventory and Analysis",aerial photography,1979,"Cole et al. 1987. Vegetation Survey of the Republic of Palau Resource Bulletin PSW-RB-22, Pacific Southwest Research Station, USDA Forest Service",America,Panama,3,report,2012,"ANAM/ONU-REDD, 2014. Mapa de cobertura boscosa y uso de la tierra 2012. Resultados preliminares",imagery,2012,"Hansen et al. 2013. ""High-Resolution Global Maps of 21st Century Forest Cover Change. Science 342 (15 November): 850:53.",Asia,Papua New Guinea,2,report,1996,"McAlpine, J & Quigley J. (Coffey MPW Pty. Ltd for AudAid: Canberra & Papua New Guinea National Forest Service. 1998. Forest Resources of Papua New Guinea. Summary Statistics from the Forest Inventory Mapping System",report,1975,"McAlpine, J & Quigley J. (Coffey MPW Pty. Ltd for AudAid: Canberra & Papua New Guinea National Forest Service. 1998. Forest Resources of Papua New Guinea. Summary Statistics from the Forest Inventory Mapping System",America,Paraguay,2,imagery,2011,Proyecto Apoyo al Deserrollo Forestal Sostenible del Paraguay TCP/PAR/3304. Atlas para la Implementacion del Ordenamiento Territorial Forestal. 2013,imagery,2002,MESA FORESTAL NACIONAL. 2002. Estudio para la identificacion de areas prioritarias para el Mangejo de Bosques Nativos y la Reforestacion. MFN/FAO/GTZ. Paraguay.,America,Peru,2,imagery,2011,"Ministerio de Agricultura y Riego, Ministerio del Ambiente. Mapa de Bosque no Bosque del ano 2000 y Mapa de perdida",report,2009,"Ministerio del Ambiente. Memoria Descriptiva. Mapa de Cobertura Vegetal del Peru. Lima, Peru 2012.",Asia,Philippines,2,imagery,2010,"2010 Land Cover Mapping. National Mapping and Resource Information Authority and FMB, Department of Environment and National Resources.",imagery,2003,"FMB. 2003. Philippine Forestry Statistics. Forest Management Bureau, Department of Environment and Natural Resources. Philippines. ",America,Puerto Rico,3,report,2009,"Brandeis, T.J., and J.A. Turner. 2013. Puerto Rico's Forests, 2009. Resource Bulletin SRS-191, USDA Forest Service Southern Research Station, Asheville NC. Pg.85",report,2003,"Brandeis, T.J., and J.A. Turner. 2007. The Status of Puerto Rico's Forests, 2003. Resource Bulletin SRS-119, USDA Forest Service Southern Research Station, Asheville NC. Pg.75",Africa,Republic of Congo,1,imagery,2004,CNIAF/MEFDD Imagerie satellitaire,report,1993,CNIAF/MEFDD Carte IGN au 1/100.000,Africa,Rwanda,1,aerial photography,2012,"Rwanda Forest Cover Mapping using high resolution aerial photographs, Dec 2012, by the GIS & Remote Sensing Research and Training Center of the National University of Rwanda.",report,2007,Rapport d'inventaire des ressources ligneuses,America,Saint Kitts and Nevis,2,imagery,2010,"Helmer et al. 2008. Land Cover and Forest Formation Distributions for St. Kitts, Nevis, St. Eustatius, Grenada and Barbados from Decision Tree Classification of Cloud-Cleared Satellite Imagery",report,1983,"Caribbean Development Bank. 1983. Regional Forestry Sector Study, Country Report St Christopher and Nevis, Caribbean Development Bank",America,Saint Lucia,2,aerial photography,2009,"Graveson, et al. 2009. Vegetation Map of St. Lucia",imagery,2001,"Schill, et al. 2006. Forest Formation and Land Cover Map Series: St. Lucia",America,Saint Vincent and the Grenadines,1,imagery,2001,"Schill, et al. 2006. Forest Formation and Land Cover Map Series: St. Lucia",report,1993,Forestry Division of the Ministry of Agriculture Industry and Labour. 1994. National Forest Inventory Report. Annex 1 of the National Resource Conservation Plan,Africa,Senegal,2,report,2009,Projet de gestion durable des forets et des energies traditionnelles de substitution (PROGEDE),report,2004,Projet de gestion durables des forets et des energies traditionnelles de substitution (PROGEDE),Africa,Sierra Leone,1,report,"1976, 1986",Laumans Paul A. 1996. Review of Existing Sources of information for Forest Resource Assessment in Sierra Leone. Working Document No X.,report,2013,"""Expert estimation"" taking factors into account such as improvement in restoration after civil war and increased plantation expansion.",Numbers used for extrapolation come from primary source.Asia,Singapore,1,report,2010,"Yee et al. 2011. The vegetation of Singapore - an updated map. The Gardens' Bulletin, Singapore 63 (1&2): 205-212. National Parks Board",report,1997,"Chan & Corlett 1997 Biodiversity in the Nature Reserves of Singapore. Proceedings of the Nature Reserve Survey Seminar. The Garden's Bulletin, Singapore Vol. 49, Part 2.",Asia,Solomon Islands,1,report,2006,"Solomon Islands Forestry Management Project (SIMP), 2006. National Forest Resources Assessment update 2006.",report,2003,"Solomon Islands Forestry Management Project (SIMP), 2003. National Forest Resources Assessment.",Africa,Somalia,1,report,1980,FAO. 1988. Interim Report FAO.,n/a,n/a,n/a,Asia,Sri Lanka,1,imagery,2010,GOSL. 2010. Forest Cover Mapping 2010. Forest Inventory Division. Forest Department. Sri Lanka.,imagery,1996,GOSL. 2000. Forest Cover Mapping 2000. Forest Inventory Division. Forest Department. Sri Lanka.,Africa,Sudan,1,Atlas,2012,Sudan Land Cover Atlas. 2012. FAO/SIFSIA.,report,2000,"Dawelbait et al. 2006. Estimating forest cover and forest change in Sudan. Forest Resources Assessment Working Paper 109. FAO, Rome",America,Suriname,2,imagery,"2000, 2009",Observation Room of Suriname. Remote sensing project to monitor forests.,n/a,n/a,n/a,Africa,Swaziland,2,report,1999,Central Statistics Office,report,1990,"Thurland, M. 1999. Forest Resource Assessment",Africa,Tanzania,2,report,2014,Ministry of Natural Resources and Tourism 2014 National Forest Resources Monitoring and Assessment (NAFORMA) Final Report.,report,2012,"Ministry of Natural Resources and Tourism. 2012. Participatory Forest Management in Tanzania, Facts and Figures.",Asia,Thailand,2,report,2008,"RFD, 2008. Statistical Data 2008. Office of Planning and Information, Royal Forest Department. Thailand.",report,2007,"RFD, 2007. Statistical Data 2007. Office of the Secretary. Royal Forest Department. Thailand.",Africa,The Gambia,1,report,2010,National Forest Assessment (NFA 2009/2010),report,1998,National Forest Assessment 2008-2010. National Action Programme to Combat Desertification (NAP) 2000: The Gambia.,Asia,Timor Leste,1,report,2008,Ongoing National Forest Inventory,report,2007,Forestry Annual Report,Introduction explains that there is no reliable data. In part due to political instability.Africa,Togo,1,report,1975,partial national inventory,n/a,n/a,n/a,there are technically no data sources listed in the report.America,Trinidad and Tobago,2,aerial photography,1994,Internal Records Drawing Office Forestry Division,aerial photography,1970,Forest Resource Inventory and Management Section Inventory of the Indigenous Forests of Trinidad and Tobago. 1980. ,America,Turks and Caicos Islands,1,report,1983,"Caribbean Development Bank. 1983. Regional Forest Sector Study, Final Report, Caribbean Development Bank/DFS.",n/a,n/a,n/a,Africa,Uganda,2,imagery,2005,National Forest Authority GIS and Mapping,report,1992,National Biomass Technical Report: 2003,America,US Virgin Islands,3,report,2009,"US Forest Service, Forest Inventory and Analysis Database",report,2004,"US Forest Service, Forest Inventory and Analysis Database",America,Venezuela,2,imagery,2010,"Ministerio del Poder Popular para el Ambiente (MPPA). 2011. Mapa de Cobertura Vegetal de Venezuela. Inventario Nacional Forestal. Escala 1:250.000. Despacho del Viceministro de Conservacion Ambiental, Direccion General de Bosques. Caracas, Venezuela.",report,1995,"Ministerio del Ambiente y Recursos Naturales (MARN). 1999. Mapa de la Vegetacion de Venezuela. Escala 1:125.000. Direccion de Vegetacion. Caracas, Venezuela.",Asia,Vietnam,2,report,2007,General statistics office of Vietnam,report,2005,"National program for surveying, evluating the changes of forest resources",Africa,Zambia,2,report,2007,"Zambia Forestry Department 2009, Integrated Land Use Assessment (ILUA)",report,1974,Chakanga M & de Backer M. 1986. The forest vegetation of Zambia. Wood Consumption and Resource Survey of Zambia.,Africa,Zimbabwe,1,report,2008,VeGRIS 2008,report,1992,"Kwesha, D. & Dreiser, D. 1997, Vegetation mapping in Zimbabwe - VEGRIS",